{
  "task_id": "native_service_port_mismatch_productcatalogservice_001",
  "family": "native_service_port_mismatch",
  "scenario": "productcatalogservice Service targetPort is changed away from the container port",
  "split": "dev",
  "difficulty": "medium",
  "fault_spec": {
    "type": "native_service_port_mismatch",
    "target_service": "productcatalogservice",
    "injected_at": "phase_0",
    "parameters": {
      "experiment_file": "experiments/native_service_port_mismatch_productcatalogservice_baseline.yaml",
      "detector_primary_signal": "service_port_alignment"
    }
  },
  "initial_context": "PagerDuty alert: an incident has been detected affecting productcatalogservice. The monitoring pipeline observed availability symptoms. Investigate and recommend the most appropriate remediation action.",
  "phases": [
    {
      "phase_id": 0,
      "label": "initial_degradation",
      "tool_responses": {
        "get_k8s_state|service=productcatalogservice": {
          "service": "productcatalogservice",
          "timestamp": "2026-04-18T03:56:04.704805Z",
          "desired_replicas": 1,
          "available_replicas": 1,
          "rollout_progressing": false,
          "restart_count": 0,
          "pod_phases": [
            {
              "pod_name": "productcatalogservice-576fdbff8c-f2f2l",
              "phase": "Running",
              "ready": true,
              "restart_count": 0,
              "labels": {
                "app": "productcatalogservice",
                "pod-template-hash": "576fdbff8c"
              },
              "container_ports": [
                {
                  "container": "server",
                  "name": "",
                  "containerPort": 3550,
                  "protocol": "TCP"
                }
              ]
            }
          ],
          "service_config_summary": {
            "service": "productcatalogservice",
            "exists": true,
            "selector": {
              "app": "productcatalogservice"
            },
            "selected_pod_count": 1,
            "deployment_pod_count": 1,
            "deployment_pod_labels": [
              {
                "name": "productcatalogservice-576fdbff8c-f2f2l",
                "labels": {
                  "app": "productcatalogservice",
                  "pod-template-hash": "576fdbff8c"
                },
                "ready": true
              }
            ],
            "service_ports": [
              {
                "name": "grpc",
                "port": 3550,
                "targetPort": 1,
                "protocol": "TCP"
              }
            ],
            "container_ports": [
              {
                "container": "server",
                "name": "",
                "containerPort": 3550,
                "protocol": "TCP"
              }
            ],
            "endpoint_counts": {
              "effective_ready": 1,
              "effective_not_ready": 0,
              "raw_endpoints_ready": 1,
              "raw_endpoints_not_ready": 0,
              "endpoint_slice_ready": 1,
              "endpoint_slice_not_ready": 0
            },
            "service_port_alignment": {
              "aligned": false,
              "mismatches": [
                {
                  "service_port": 3550,
                  "targetPort": 1,
                  "reason": "numeric targetPort is not exposed by any selected deployment pod container"
                }
              ]
            },
            "anomalies": [
              "service_target_port_mismatch"
            ],
            "takeaway": "Service targetPort does not match exposed deployment container ports: [{'service_port': 3550, 'targetPort': 1, 'reason': 'numeric targetPort is not exposed by any selected deployment pod container'}]"
          },
          "recent_events": [],
          "deployment_selector": {
            "app": "productcatalogservice"
          },
          "deployment_config": {
            "deployment": "productcatalogservice",
            "replicas": 1,
            "containers": [
              {
                "name": "server",
                "image": "us-central1-docker.pkg.dev/google-samples/microservices-demo/productcatalogservice:v0.10.4",
                "ports": [
                  {
                    "name": "",
                    "containerPort": 3550,
                    "protocol": "TCP"
                  }
                ],
                "env": [
                  {
                    "container": "server",
                    "name": "PORT",
                    "value": "3550",
                    "value_redacted": false
                  },
                  {
                    "container": "server",
                    "name": "DISABLE_PROFILER",
                    "value": "1",
                    "value_redacted": false
                  },
                  {
                    "container": "server",
                    "name": "ENABLE_TRACING",
                    "value": "1",
                    "value_redacted": false
                  },
                  {
                    "container": "server",
                    "name": "ENABLE_STATS",
                    "value": "1",
                    "value_redacted": false
                  },
                  {
                    "container": "server",
                    "name": "COLLECTOR_SERVICE_ADDR",
                    "value": "opentelemetrycollector:4317",
                    "value_redacted": false
                  },
                  {
                    "container": "server",
                    "name": "OTEL_SERVICE_NAME",
                    "value": "productcatalogservice",
                    "value_redacted": false
                  },
                  {
                    "container": "server",
                    "name": "OTEL_RESOURCE_ATTRIBUTES",
                    "value": "service.name=productcatalogservice,deployment.environment=kind",
                    "value_redacted": false
                  }
                ],
                "envFrom": [],
                "resources": {
                  "limits": {
                    "cpu": "500m",
                    "memory": "256Mi"
                  },
                  "requests": {
                    "cpu": "200m",
                    "memory": "128Mi"
                  }
                },
                "readinessProbe": {
                  "initialDelaySeconds": 25,
                  "periodSeconds": 10,
                  "timeoutSeconds": 10,
                  "successThreshold": 1,
                  "failureThreshold": 12,
                  "grpc": {
                    "port": 3550,
                    "service": ""
                  }
                },
                "livenessProbe": {
                  "initialDelaySeconds": 45,
                  "periodSeconds": 10,
                  "timeoutSeconds": 10,
                  "successThreshold": 1,
                  "failureThreshold": 12,
                  "grpc": {
                    "port": 3550,
                    "service": ""
                  }
                },
                "startupProbe": {}
              }
            ],
            "env": [
              {
                "container": "server",
                "name": "PORT",
                "value": "3550",
                "value_redacted": false
              },
              {
                "container": "server",
                "name": "DISABLE_PROFILER",
                "value": "1",
                "value_redacted": false
              },
              {
                "container": "server",
                "name": "ENABLE_TRACING",
                "value": "1",
                "value_redacted": false
              },
              {
                "container": "server",
                "name": "ENABLE_STATS",
                "value": "1",
                "value_redacted": false
              },
              {
                "container": "server",
                "name": "COLLECTOR_SERVICE_ADDR",
                "value": "opentelemetrycollector:4317",
                "value_redacted": false
              },
              {
                "container": "server",
                "name": "OTEL_SERVICE_NAME",
                "value": "productcatalogservice",
                "value_redacted": false
              },
              {
                "container": "server",
                "name": "OTEL_RESOURCE_ATTRIBUTES",
                "value": "service.name=productcatalogservice,deployment.environment=kind",
                "value_redacted": false
              }
            ]
          },
          "service_config": {
            "selector": {
              "app": "productcatalogservice"
            },
            "ports": [
              {
                "name": "grpc",
                "port": 3550,
                "targetPort": 1,
                "protocol": "TCP"
              }
            ],
            "selected_pods": [
              {
                "name": "productcatalogservice-576fdbff8c-f2f2l",
                "labels": {
                  "app": "productcatalogservice",
                  "pod-template-hash": "576fdbff8c"
                },
                "phase": "Running",
                "ready": true,
                "pod_ip": "10.244.1.3",
                "container_ports": [
                  {
                    "container": "server",
                    "name": "",
                    "containerPort": 3550,
                    "protocol": "TCP"
                  }
                ]
              }
            ],
            "deployment_pods": [
              {
                "name": "productcatalogservice-576fdbff8c-f2f2l",
                "labels": {
                  "app": "productcatalogservice",
                  "pod-template-hash": "576fdbff8c"
                },
                "phase": "Running",
                "ready": true,